{
  "id": "apidep_evidence_000002",
  "entity_id": "apidep_entity_000002",
  "event_id": "apidep_event_000002",
  "type": "official_docs",
  "url": "https://firebase.google.com/support/dynamic-links-faq",
  "title": "Firebase Dynamic Links FAQ",
  "publisher": "Firebase",
  "published_at": null,
  "archived_url": null,
  "quote_or_summary": "Current official FAQ states Firebase Dynamic Links shut down on August 25, 2025 and its APIs are no longer available after that date.",
  "reliability": "high",
  "claim_scope": "removal",
  "last_checked_at": "2026-08-20",
  "is_primary": true,
  "is_official_domain": true,
  "notes": "Stage 7 no-change first-party follow-up."
}
