{
  "id": "apidep_evidence_000005",
  "entity_id": "apidep_entity_000005",
  "event_id": "apidep_event_000005",
  "type": "official_docs",
  "url": "https://kubernetes.io/docs/reference/using-api/deprecation-guide/",
  "title": "Deprecated API Migration Guide",
  "publisher": "Kubernetes Documentation",
  "published_at": null,
  "archived_url": null,
  "quote_or_summary": "Current official migration guide continues to list the deprecated API versions no longer served as of Kubernetes v1.22 and their supported replacements.",
  "reliability": "high",
  "claim_scope": "removal",
  "last_checked_at": "2026-08-20",
  "is_primary": true,
  "is_official_domain": true,
  "notes": "Stage 7 no-change first-party follow-up."
}
