{
  "id": "apidep_evidence_000001",
  "entity_id": "apidep_entity_000001",
  "event_id": "apidep_event_000001",
  "type": "official_docs",
  "url": "https://ai.google.dev/palm_docs/deprecation",
  "title": "PaLM API deprecation",
  "publisher": "Google AI for Developers",
  "published_at": null,
  "archived_url": null,
  "quote_or_summary": "Current official documentation states the PaLM API was decommissioned on August 15, 2024 and directs users to the Gemini API.",
  "reliability": "high",
  "claim_scope": "removal",
  "last_checked_at": "2026-08-20",
  "is_primary": true,
  "is_official_domain": true,
  "notes": "Stage 7 no-change first-party follow-up."
}
