{
  "id": "apidep_evidence_000004",
  "entity_id": "apidep_entity_000004",
  "event_id": "apidep_event_000004",
  "type": "official_docs",
  "url": "https://shopify.dev/docs/api/admin-rest",
  "title": "REST Admin API reference",
  "publisher": "Shopify Developers",
  "published_at": null,
  "archived_url": null,
  "quote_or_summary": "Current official documentation describes REST Admin API as legacy as of October 1, 2024 and states that starting April 1, 2025 new public apps must use GraphQL Admin API; it does not establish that date as a universal removal deadline for all existing REST integrations.",
  "reliability": "high",
  "claim_scope": "migration",
  "last_checked_at": "2026-08-20",
  "is_primary": true,
  "is_official_domain": true,
  "notes": "Stage 7 first-party follow-up corrected the earlier deadline scope."
}
