{
  "id": "apidep_evidence_000003",
  "entity_id": "apidep_entity_000003",
  "event_id": "apidep_event_000003",
  "type": "official_changelog",
  "url": "https://docs.slack.dev/changelog/2024-04-a-better-way-to-upload-files-is-here-to-stay/",
  "title": "The files.upload method is retiring, to be replaced by sequenced Web API methods",
  "publisher": "Slack Developer Docs",
  "published_at": "2024-04-09",
  "archived_url": null,
  "quote_or_summary": "Slack's official changelog records the files.upload deprecation, replacement upload flow, and final November 12, 2025 sunset date.",
  "reliability": "high",
  "claim_scope": "deprecation",
  "last_checked_at": "2026-08-20",
  "is_primary": true,
  "is_official_domain": true,
  "notes": "Stage 7 follow-up confirmed the final sunset date after the earlier retirement-date extension."
}
