{
  "id": "apidep_evidence_000007",
  "entity_id": "apidep_entity_000007",
  "event_id": "apidep_event_000007",
  "type": "official_changelog",
  "url": "https://github.blog/changelog/2021-08-12-git-password-authentication-is-shutting-down/",
  "title": "Git password authentication is shutting down",
  "publisher": "GitHub Changelog",
  "published_at": "2021-08-12",
  "archived_url": null,
  "quote_or_summary": "GitHub states that starting August 13, 2021 it no longer accepts account passwords for authenticated Git operations and requires token-based authentication such as personal access, OAuth, SSH, or GitHub App tokens.",
  "reliability": "high",
  "claim_scope": "removal",
  "last_checked_at": "2026-08-19",
  "is_primary": true,
  "is_official_domain": true,
  "notes": "Primary source for the removal boundary and replacement authentication methods."
}