{
  "id": "apidep_evidence_000010",
  "entity_id": "apidep_entity_000010",
  "event_id": "apidep_event_000010",
  "type": "official_migration_guide",
  "url": "https://learn.microsoft.com/en-us/graph/migrate-azure-ad-graph-overview",
  "title": "Migrate from Azure Active Directory (Azure AD) Graph to Microsoft Graph",
  "publisher": "Microsoft Learn",
  "published_at": null,
  "archived_url": null,
  "quote_or_summary": "Microsoft's migration guide states that extended access to Azure AD Graph ended on August 31, 2025 and the API is fully retired, with Microsoft Graph as the migration target.",
  "reliability": "high",
  "claim_scope": "removal",
  "last_checked_at": "2026-08-20",
  "is_primary": true,
  "is_official_domain": true,
  "notes": null
}